{
  "title": "T",
  "questions_per_quiz": 1,
  "questions": [
    {
      "text": "Q1",
      "options": [
        {
          "text": "A",
          "correct": true
        },
        {
          "text": "B"
        }
      ]
    },
    {
      "text": "Q2",
      "options": [
        {
          "text": "A",
          "correct": true
        },
        {
          "text": "B"
        }
      ]
    }
  ],
  "language": "xx"
}
