{
  "title": {
    "en": "T",
    "it": "T"
  },
  "languages": [
    "en",
    "it"
  ],
  "questions_per_quiz": 1,
  "questions": [
    {
      "text": {
        "en": "Q1",
        "it": "D1"
      },
      "options": [
        {
          "text": {
            "any": "A"
          },
          "correct": true
        },
        {
          "text": {
            "en": "B",
            "it": "Bi"
          }
        }
      ]
    },
    {
      "text": {
        "any": "Q2"
      },
      "options": [
        {
          "text": {
            "any": "A"
          },
          "correct": true
        },
        {
          "text": {
            "any": "B"
          }
        }
      ]
    }
  ],
  "ui": {
    "start": {
      "any": "Go!",
      "it": "Via!"
    },
    "next": {
      "it": "Avanti"
    },
    "messages": {
      "great": {
        "en": "Wow"
      }
    }
  }
}
