{
  "title": {
    "en": "T",
    "it": "T"
  },
  "languages": [
    "en",
    "it"
  ],
  "questions_per_quiz": 1,
  "questions": [
    {
      "text": {
        "en": "Q1",
        "it": "D1"
      },
      "options": [
        {
          "text": "A",
          "correct": true
        },
        {
          "text": "B"
        }
      ]
    },
    {
      "text": {
        "en": "only english"
      },
      "options": [
        {
          "text": {
            "any": "A"
          },
          "correct": true
        },
        {
          "text": {
            "any": "B"
          }
        }
      ]
    }
  ]
}
